{
  "generated_at": "2026-04-20T19:37:11",
  "ranker_version": "0.1.0-step0.1",
  "dimensions_used": [
    "conflict",
    "hub"
  ],
  "systems_scope": {
    "total": 222,
    "limited_to": 30,
    "selection_rule": "hub_degree_top_30"
  },
  "targets": [
    {
      "rank": 1,
      "name": "PK_변신 및 스킬 시스템",
      "grade": "S",
      "rationale": "8개 distinct topic에 걸쳐 16건의 verified evidence(high 6건, medium 9건)가 확인되며, conflict density(8.75)와 hub(7.5) 모두 상위권입니다. '강화 시스템 전체', '변신 탭 구조', '합성 실패 게이지' 등 핵심 설계 요소에서 Excel 내부 및 Confluence 간 구조적 차이가 다수 발견되었습니다. 정리 시 전투·스킬·HUD 등 3개 이상의 강결합 허브에 즉시 반영되어 기획자의 의도 전달과 Agent 응답 정확도가 동시에 개선됩니다.",
      "dimension_scores": {
        "conflict": {
          "value": 8.75,
          "raw": 21.0,
          "facts": {
            "distinct_topics": 8,
            "verified_evidence": 16,
            "confirmed": 16,
            "uncertain": 0,
            "by_confidence": {
              "high": 6,
              "medium": 9,
              "low": 1
            },
            "sample_topics": [
              "폐기후보::강화 시스템 전체",
              "구조적차이::변신 탭 구조",
              "정보누락::외형변경 및 공성전 시스템",
              "정보누락::합성 실패 게이지 (천장 시스템)",
              "구조적차이::클래스 제한 로직"
            ]
          }
        },
        "hub": {
          "value": 7.5,
          "raw": 27.0,
          "facts": {
            "raw_degree": 27,
            "weighted_degree": 27.0,
            "strong": 10,
            "weak": 7,
            "loose": 10,
            "top_strong_targets": [
              "Confluence/시스템 디자인/변신",
              "Confluence/시스템 디자인/스킬/스킬 시스템",
              "PK_기본 전투 시스템",
              "PK_버프 시스템",
              "PK_변신_검사_치우현"
            ]
          }
        }
      },
      "evidence": [
        {
          "dimension": "conflict",
          "cited_text": "✔ 기본 화면은 안전 강화 / 확률 강화 구분 없이 동일한 UI 사용",
          "source": {
            "kind": "excel",
            "workbook": "PK_변신 및 스킬 시스템",
            "title": "Excel / PK_변신 및 스킬 시스템 / UI_변신_강화"
          },
          "reason": "Excel 원문에서 UI_변신_강화 시트 전체가 안전 강화와 확률 강화 플로우를 상세히 기술하고 있으며, 진입 방법으로 '변신 메뉴 진입 후 강화 탭 클릭'을 명시. Confluence 측에서는 '기존과 동일하나, 강화 탭 제거'를 여러 섹션에서 반복 언급. 두 문서 간 강화 시스템 존재 여부가 명확히 상이함.",
          "confidence": "high",
          "verified_by_cov": true
        },
        {
          "dimension": "conflict",
          "cited_text": "[2-1] 목록, [2-2] 목록, [2-3] 합성, [2-4] 보유효과 모든 섹션에서 '기존과 동일하나, 강화 탭 제거'를 명시. [1-2] 설계 변화 동기에서 '성장 피로도', '천장 시스템 부재' 등을 이유로 시스템 개편 설명",
          "source": {
            "kind": "confluence",
            "page_path": "Design\\시스템 디자인\\변신\\변신 개선 시스템 기획",
            "title": "Confluence / 변신 시스템 개편"
          },
          "reason": "Confluence 원문에서 [2-1], [2-2], [2-3], [2-4] 모든 섹션에서 '강화 탭 제거'를 명시하고 있으며, [1-2] 설계 변화 동기에서 성장 피로도와 천장 시스템 부재를 이유로 시스템 개편을 설명. Excel 측에는 강화 시스템이 상세히 존재. 충돌이 실제로 확인됨. [quote 원문 미일치 — 재확인 권장]",
          "confidence": "medium",
          "verified_by_cov": false
        },
        {
          "dimension": "conflict",
          "cited_text": "탭 메뉴: 목록, 합성, 강화(선택됨), 컬렉션, 확정.",
          "source": {
            "kind": "excel",
            "workbook": "PK_변신 및 스킬 시스템",
            "title": "Excel / PK_변신 및 스킬 시스템 / UI_변신_강화"
          },
          "reason": "Excel 원문에서 탭 구성이 '목록 | 합성 | 강화 | 컬렉션 | 확정' 5개 탭으로 명시되어 있음. Confluence 측에서는 '목록 | 합성 | 보유효과' 3개 탭으로 변경되었으며, 강화와 확장 탭이 제거되고 컬렉션이 보유효과로 명칭 변경. 탭 구조가 실제로 상이함.",
          "confidence": "high",
          "verified_by_cov": true
        },
        {
          "dimension": "conflict",
          "cited_text": "탭 구성: 목록 | 합성 | 보유효과 (3개 탭). '컬렉션'이 '보유효과'로 명칭 변경되었으며, '강화'와 '확장' 탭 제거됨",
          "source": {
            "kind": "confluence",
            "page_path": "Design\\시스템 디자인\\변신\\변신 개선 시스템 기획",
            "title": "Confluence / 변신 시스템 개편"
          },
          "reason": "Confluence 원문에서 탭 구성이 '목록 | 합성 | 보유효과' 3개로 명시되고, 컬렉션이 보유효과로 변경되었으며 강화와 확장 탭이 제거되었다고 기술. Excel 측에는 5개 탭 구조가 존재. 구조적 차이가 실제로 확인됨. [quote 원문 미일치 — 재확인 권장]",
          "confidence": "medium",
          "verified_by_cov": false
        },
        {
          "dimension": "conflict",
          "cited_text": "변신에 외형 및 고유 스킬 애니메이션이 귀속됨에 따라 외형만 변경하는 \"스킨\" 기능은 활용이 어려움",
          "source": {
            "kind": "excel",
            "workbook": "PK_변신 및 스킬 시스템",
            "title": "Excel / PK_변신 및 스킬 시스템 / 변신"
          },
          "reason": "Excel 원문에서 스킨 기능은 활용이 어렵다고 명시하며, 외형변경이나 공성전 아바타 개념이 없음. Confluence 측에서는 변신/외형변경/공성전 3개 착용 슬롯 및 Type 컬럼(Metamorph, Skin, Siege)을 상세히 정의. 시스템 범위가 실제로 상이함.",
          "confidence": "high",
          "verified_by_cov": true
        },
        {
          "dimension": "conflict",
          "cited_text": "[2-2] 목록에서 '변신/외형변경/공성전' 3개 착용 슬롯 및 탭 구조 상세 기술. MetamorphClass에 Type 컬럼(Metamorph, Skin, Siege) 추가. 각 타입별 필터링 및 장착 로직 정의",
          "source": {
            "kind": "confluence",
            "page_path": "Design\\시스템 디자인\\변신\\변신 개선 시스템 기획",
            "title": "Confluence / 변신 시스템 개편"
          },
          "reason": "Confluence 원문에서 변신/외형변경/공성전 3개 타입과 착용 슬롯을 상세히 정의하고 있으며, MetamorphClass에 Type 컬럼 추가를 명시. Excel 측에는 이러한 개념이 없고 스킨 기능은 활용 어렵다고 기술. 정보 누락이 실제로 확인됨. [quote 원문 미일치 — 재확인 권장]",
          "confidence": "medium",
          "verified_by_cov": false
        },
        {
          "dimension": "hub",
          "cited_text": "PK_변신 및 스킬 시스템 ↔ Confluence/시스템 디자인/변신",
          "source": {
            "kind": "graph_edge",
            "target": "Confluence/시스템 디자인/변신"
          },
          "reason": "대상 시스템 이름에 '변신'이 명시되어 있고, 시트에 'UI_변신_강화', 'UI_변신_기본', '변신' 등이 포함되어 있어 이 Confluence 문서는 변신 시스템의 설계 명세를 직접 공유하는 관계.",
          "confidence": "high",
          "verified_by_cov": true
        },
        {
          "dimension": "hub",
          "cited_text": "PK_변신 및 스킬 시스템 ↔ Confluence/시스템 디자인/스킬/스킬 시스템",
          "source": {
            "kind": "graph_edge",
            "target": "Confluence/시스템 디자인/스킬/스킬 시스템"
          },
          "reason": "대상 시스템 이름에 '스킬 시스템'이 명시되어 있고, 시트에 'UI_스킬', '스킬', '스킬 기능 리스트'가 포함되어 있어 이 Confluence 문서는 스킬 시스템의 설계 명세 및 FX 연출 정책을 직접 공유하는 관계.",
          "confidence": "high",
          "verified_by_cov": true
        },
        {
          "dimension": "hub",
          "cited_text": "PK_변신 및 스킬 시스템 ↔ PK_기본 전투 시스템",
          "source": {
            "kind": "graph_edge",
            "target": "PK_기본 전투 시스템"
          },
          "reason": "스킬 시스템은 전투 시스템의 공격 처리 플로우에서 스킬 발동 수식과 타이밍을 직접 참조하며, 변신은 전투 스탯 및 스킬셋 변경을 통해 전투 동작에 즉시 영향을 주는 구조적 결합.",
          "confidence": "high",
          "verified_by_cov": true
        }
      ],
      "blast_radius_note": "전투·스킬·버프 시스템, HUD, 검사 문서 등 10개 strong 의존 대상에 직접 결합. 변신 UI 구조 변경 시 전투 플로우 전반에 영향.",
      "effort": "L",
      "confidence_flags": []
    },
    {
      "rank": 2,
      "name": "PK_HUD 시스템",
      "grade": "S",
      "rationale": "9개 topic, 18건 evidence(high 13건)로 conflict density 9.67을 기록하며, hub degree도 25.5로 높습니다. 'HUD 영역 구분 체계', '퀵슬롯 규격', '버프 우선순위' 등 UI 레이아웃과 데이터 바인딩 규칙이 Excel과 Confluence에서 상이한 방식으로 기술되어 있습니다. 전투·스탯·보상·전투력 등 6개 strong target과 직접 연결되어 있어, 정리 시 UI 관련 질의 전반의 일관성이 크게 향상됩니다.",
      "dimension_scores": {
        "conflict": {
          "value": 9.67,
          "raw": 23.2,
          "facts": {
            "distinct_topics": 9,
            "verified_evidence": 18,
            "confirmed": 16,
            "uncertain": 2,
            "by_confidence": {
              "high": 13,
              "medium": 3,
              "low": 2
            },
            "sample_topics": [
              "구조적차이::HUD 영역 구분 체계",
              "수치불일치::퀵슬롯 규격 및 배치",
              "정보누락::버프/디버프 우선순위 규칙",
              "구조적차이::메뉴 아이콘 카테고리 분류",
              "정보누락::화폐 UI 터치 박스 및 계층 구조"
            ]
          }
        },
        "hub": {
          "value": 7.08,
          "raw": 25.5,
          "facts": {
            "raw_degree": 24,
            "weighted_degree": 25.5,
            "strong": 6,
            "weak": 15,
            "loose": 3,
            "top_strong_targets": [
              "PK_기본 전투 시스템",
              "PK_변신 및 스킬 시스템",
              "PK_보상 시스템",
              "PK_스탯 및 공식",
              "PK_전투력 시스템"
            ]
          }
        }
      },
      "evidence": [
        {
          "dimension": "conflict",
          "cited_text": "Excel은 기능별 번호 체계(①~⑰)로 HUD 요소를 분류하며, 비전투/전투 시나리오를 별도 시트로 구분. 레이아웃은 이미지 기반 설명.",
          "source": {
            "kind": "excel",
            "workbook": "PK_HUD 시스템",
            "title": "Excel / PK_HUD 시스템 / HUD_기본"
          },
          "reason": "Excel 원문에서 '번호 | 이름 | 분류' 형태의 테이블과 '① 레벨 / HP,MP 정보', '② 버프/디버프 정보' 등 번호 체계가 명확히 확인됨. 'HUD_기본'과 'HUD_전투' 시트가 분리되어 있어 시나리오별 구분도 확인됨. Confluence 측 '9개 영역(3x3 그리드)' 체계와는 구조적으로 상이함. [quote 원문 미일치 — 재확인 권장]",
          "confidence": "medium",
          "verified_by_cov": false
        },
        {
          "dimension": "conflict",
          "cited_text": "| 번호 | 이름 | 분류 | 기본 출력 | 조건부 출력 | 출력 시 출력 UI | 진행 상황 | | | 코멘트 |",
          "source": {
            "kind": "confluence",
            "page_path": "Design\\시스템 디자인\\UX UI 규칙\\UX 규칙 문서\\HUD 기능적 레이아웃 구성",
            "title": "Excel / PK_HUD 시스템 / HUD_기본"
          },
          "reason": "Excel 원문에서 번호 기반 테이블 구조가 확인되며, Confluence가 주장하는 '9개 영역(3x3 그리드, Anchored 기준)' 체계는 Excel 문서에 존재하지 않음. 두 문서의 HUD 구조화 방식이 실제로 상이함.",
          "confidence": "high",
          "verified_by_cov": true
        },
        {
          "dimension": "conflict",
          "cited_text": "| 구성 요소 | 분류 | 슬롯 수 | 내용 |",
          "source": {
            "kind": "excel",
            "workbook": "PK_HUD 시스템",
            "title": "Excel / PK_HUD 시스템 / HUD_전투"
          },
          "reason": "Excel 원문에서 슬롯 크기나 간격에 대한 구체적 수치(px 단위)가 확인되지 않음. '슬롯 수'와 '내용' 컬럼만 존재하며, Confluence가 제시한 '180x180px', '90x90px', '간격 12px' 등의 수치는 Excel에 없음. 실제로 수치 불일치 상태임.",
          "confidence": "high",
          "verified_by_cov": true
        },
        {
          "dimension": "conflict",
          "cited_text": "→ 슬롯 그룹 표현",
          "source": {